{
  "schema_id": "ECTOS_COMMON_PACKAGE_MANIFEST_V0",
  "package_type": "ECTOS_DEV_SELFTEST",
  "package_id": "ECTOS_DEV_SELFTEST_PRODUCT_V01",
  "version": "1.0.0",
  "source_commit": "SELFTEST_SOURCE_BOUND_BY_PARENT_SUCCESSOR",
  "build_id": "ECTOS_DEV_V1_SELFTEST",
  "package_hash": null,
  "target_runtime": ["WindowsPowerShell5.1"],
  "supported_os": ["Windows"],
  "supported_powershell_version": ["5.1"],
  "entrypoint": "main.ps1",
  "expected_output_contract": "ECTOS_DEV_SELFTEST_PRODUCT_RESULT_V01",
  "side_effect_contract": "NONE",
  "mutation_policy": "READ_ONLY",
  "dependencies": [],
  "test_profile": "ECTOS_DEV_V1_PRODUCER_SELFTEST_V01",
  "qualification_profile": "ECTOS_DEV_SELFTEST_QF_HANDOFF_PROFILE_V01",
  "install_profile": "PARSE_ENTRYPOINT",
  "rollback_profile": "DELETE_EPHEMERAL_BUILD_WORKSPACE",
  "evidence_profile": "PRODUCER_SELFTEST_ONLY",
  "dependency_graph": "ECTOS_PACKAGE_DEPENDENCY_GRAPH_V01.json"
}
